Company,Name of program/role,Type,Course Progression,Roles,Status,Location,Duration,Open,Close,Industry,Work rights required,URL,Description,Notes,Last updated
Commonwealth Bank,Engineering and Cyber Security Graduate Program,Grad Program,Ultimate/Grad,"AI & ML Engineer, Cloud Engineer, Cyber Security, Machine Learning Engineer, Mobile App Developer",Closed,"Adelaide, Brisbane, Melbourne, Perth, Sydney",12-24 months,March,April,Banking,"Australian Citizen, Australian Permanent Resident",https://prosple.com/graduate-employers/commonwealth-bank/jobs-internships/engineering-and-cyber-security-graduate-program,,,"March 15, 2024 1:45 PM"
Commonwealth Bank,Data Science and Analytics Graduate Program,Grad Program,Ultimate/Grad,"Business Analyst, Data Science Engineer, Technology Risk",Closed,"Adelaide, Brisbane, Melbourne, Perth, Sydney",12-24 months,March,April,Banking,"Australian Citizen, Australian Permanent Resident",https://prosple.com/graduate-employers/commonwealth-bank/jobs-internships/data-science-and-analytics-graduate-program,,,"March 15, 2024 1:45 PM"
Commonwealth Bank,,Summer Internship,Penultimate,"Business Analyst, Cyber Security Advisor, Data Engineer, Data Manager, DevOps Engineer, Machine Learning Engineer, Penetration Tester, Project Manager, Security Engineer, Software Engineer, Systems Engineer, Technical Analyst",Closed,Sydney,Summer,July,August,"Banking, Finance","Australian Citizen, Australian Permanent Resident, New Zealand Citizen",https://www.commbank.com.au/about-us/careers/graduate-intern-programs.html,,,"March 15, 2024 1:45 PM"
Culture Amp,,Summer Internship,Penultimate,Software Engineer,Closed,Melbourne,Summer,,November,Technology,,,,,"March 15, 2024 1:45 PM"
Deloitte,Graduate Program,Grad Program,Ultimate/Grad,"Analytics and Cognitive, Business Engineer, Cloud Engineer, Data Analyst, Platforms Engineer, Software Engineer, Technology Audit",Closed,"Canberra, Melbourne, Perth, Sydney",12 Months,,,Consulting,"Australian Citizen, Australian Permanent Resident, International, New Zealand Citizen",https://www.deloitte.com/au/en/careers/students/graduate-program-careers.html,,,"March 15, 2024 1:45 PM"
Deloitte,Foundations Program,Program,Pre-Penultimate,Tech Consultant,Closed,"Canberra, Melbourne, Perth, Sydney",2-3 Days,,,Consulting,,,,,"March 15, 2024 1:45 PM"
Department of Defence,STEM Cadetship,1 Year+ Internship,Penultimate,"Cyber Security, Data Analyst, Data Scientist, IT, Software Engineer",Closed,"Adelaide, Brisbane, Canberra, Melbourne, New Castle, Perth, Sydney",12-36 Months,February,,"Defense, Government, Technology",Australian Citizen,https://www.defence.gov.au/jobs-careers/student-pathways/stem-cadetship,,,"March 15, 2024 1:45 PM"
Department of Defence,Graduate Program,Grad Program,Ultimate/Grad,"Cyber Security, Data Analyst, Data Scientist, IT, Software Engineer",Closed,"Adelaide, Brisbane, Canberra, Melbourne, New Castle, Perth, Sydney",,February,,"Defense, Government, Technology",Australian Citizen,https://www.defence.gov.au/jobs-careers/graduate-program,,,"March 15, 2024 1:45 PM"
Deputy,,Summer Internship,Penultimate,"Product Designer, Software Engineer",Closed,"Melbourne, Sydney","Semester 1, Semester 2, Summer",,,Technology,,,,,"March 15, 2024 1:45 PM"
Electronic Arts,"Software Engineer Intern FireMonkeys ",6/12 Month Internship,Ultimate/Grad,Software Engineer,Closed,Melbourne,12-24 months,January,February,Gaming,Australian Citizen,,Software Engineering Intern - need to have graduated and specialise in C++ and C#,,"March 15, 2024 1:45 PM"
EY,Vactioner,Summer Internship,Penultimate,"Cyber Security, Data Analyst, Technology Risk",Closed,"Canberra, Melbourne, Sydney",Summer,February,March,Consulting,"Australian Citizen, Australian Permanent Resident, International, New Zealand Citizen",https://www.ey.com/en_au/careers/students-apply-here,,Also available through the IBL program.,"March 15, 2024 1:45 PM"
EY,Career Compass,Program,Pre-Penultimate,Tech Consultant,Closed,"Canberra, Melbourne, Perth, Sydney",1 day,,,Consulting,,,,,"March 15, 2024 1:45 PM"
EY,Graduate Program,Grad Program,Ultimate/Grad,"Cyber Security, Data Analyst, Technology Risk",Closed,"Canberra, Melbourne, Sydney",,,,Consulting,"Australian Citizen, Australian Permanent Resident, International, New Zealand Citizen",https://www.ey.com/en_au/careers/students-apply-here,,,"March 15, 2024 1:45 PM"
Google,,Summer Internship,Penultimate,"Cloud Engineer, Software Engineer",Closed,Sydney,Summer,February,March,Technology,"Australian Citizen, Australian Permanent Resident, International, New Zealand Citizen","https://careers.google.com/jobs/results/?distance=50&employment_type=INTERN&hl=en&jlo=en-US&location=Sydney,%20Australia&q=",,,"March 15, 2024 1:45 PM"
Google,STEP,Summer Internship,Pre-Penultimate,Software Engineer,Closed,Sydney,Summer,February,March,Technology,"Australian Citizen, Australian Permanent Resident, International, New Zealand Citizen","https://careers.google.com/jobs/results/?distance=50&employment_type=INTERN&hl=en&jlo=en-US&location=Sydney,%20Australia&q=",,,"March 15, 2024 1:45 PM"
IBM,,Grad Program,Ultimate/Grad,"Business Analyst, Data Scientist, DevOps Engineer, Software Developer, Technical Specialist, UX/UI Designer",Closed,Sydney,6-12 months,December,,Technology,No information,https://www.ibm.com/au-en/employment/entrylevel/,,,"March 15, 2024 1:45 PM"
IBM,IBM Internship Program,6/12 Month Internship,"Penultimate, Pre-Penultimate, Ultimate/Grad",,Closed,"Melbourne, Sydney",6-12 months,,January,Technology,"Australian Citizen, Australian Permanent Resident, New Zealand Citizen",https://au.prosple.com/graduate-employers/ibm/jobs-internships/ibm-internship-program,,,"March 15, 2024 1:45 PM"
IMC,,Grad Program,Ultimate/Grad,"Hardware Engineer, Quantitative Researcher, Systems Engineer, Trader",Closed,Sydney,12-24 months,,May,Trading,"Australian Citizen, Australian Permanent Resident, New Zealand Citizen",https://careers.imc.com/ap/en/internships-program,,"IMC offers the IMC launchpad program, a one day event where pre-penultimate students can learn about IMC.","March 15, 2024 1:45 PM"
IMC,Launchpad,Program,Pre-Penultimate,"Software Engineer, Trader",Closed,Sydney,2-3 Days,,,Trading,,,,,"March 15, 2024 1:45 PM"
ING Bank Australia,International Talent Programme,Grad Program,"Penultimate, Ultimate/Grad",,Closed,Sydney,12-24 months,,,Banking,"Australian Citizen, Australian Permanent Resident, Australian Temporary Work Visa",https://prosple.com/graduate-employers/ing-bank-australia/jobs-internships/2023-graduate-programs,,"*desirable to have no more than 2 years of professional working experience
*open and close dates not specified","March 15, 2024 1:45 PM"
Jacobs,Intern Program,Summer Internship,Pre-Penultimate,"Data Scientist, Network Engineer, Software Engineer, Systems Engineer",Closed,Australia Wide,12 weeks,July,July,Technology,"Australian Citizen, Australian Permanent Resident, International, New Zealand Citizen",https://prosple.com/graduate-employers/jacobs-australia/jobs-internships/202223-summer-internship-program-australia,,Open for pre-register on Prosple,"March 15, 2024 1:45 PM"
Jacobs,Graduate Program,Grad Program,Ultimate/Grad,"Data Scientist, Network Engineer, Software Engineer, Systems Engineer",Closed,Australia Wide,24 months,March,March,Technology,"Australian Citizen, Australian Permanent Resident, International, New Zealand Citizen",https://prosple.com/graduate-employers/jacobs-australia/jobs-internships/2024-graduate-program-australia,,Open for pre-register on Prosple,"March 15, 2024 1:45 PM"
Jane Street,See/Insight/WiSE,Program,Pre-Penultimate,"Software Engineer, Trader",Closed,Hong Kong,2-3 Days,,,Trading,"Australian Citizen, Australian Permanent Resident, International, New Zealand Citizen",,,,"March 15, 2024 1:45 PM"
Jump Trading,,Summer Internship,Penultimate,"DevOps Engineer, Hardware Engineer, Quantitative Researcher, Software Engineer",Closed,Shanghai,Summer,,,"Finance, Technology, Trading",,https://www.jumptrading.com/careers/?titleSearch=campus+intern,,,"March 15, 2024 1:45 PM"
KordaMentha,,Summer Internship,Penultimate,"Data Analyst, Forensics Technology",Closed,Melbourne,Summer,,,,,https://kordamentha.com/careers/graduate-careers,,,"March 15, 2024 1:45 PM"
KPMG,Foundations Program,Program,Pre-Penultimate,Tech Consultant,Closed,"Adelaide, Canberra, Melbourne, Sydney",1 day,,,Consulting,,,,,"March 15, 2024 1:45 PM"
KPMG,Graduate,Grad Program,Ultimate/Grad,"Cyber Security, Data Analyst, Technology Advisory, Technology Risk",Closed,"Adelaide, Canberra, Hobart, Melbourne, Sydney",,February,April,Consulting,"Australian Permanent Resident, Full working rights, International",https://kpmg.com/au/en/home/careers/graduates.html#gradprogram,,,"March 15, 2024 1:45 PM"
Leidos,Graduate Business Analyst,Grad Program,"Penultimate, Pre-Penultimate, Ultimate/Grad",Business Analyst,Closed,"Canberra, Melbourne",12 Months,March,April,Technology,Australian Citizen,https://prosple.com/graduate-employers/leidos/jobs-internships/graduate-business-analyst,,,"March 15, 2024 1:45 PM"
Leidos,Graduate Systems Engineer,Grad Program,"Penultimate, Pre-Penultimate, Ultimate/Grad",Systems Engineer,Closed,"Canberra, Melbourne",12 Months,March,May,Technology,Australian Citizen,https://prosple.com/graduate-employers/leidos/jobs-internships/2024-graduate-systems-engineer-melbourne-cbd-scoresby-and-canberra,,,"March 15, 2024 1:45 PM"
Leidos,,Summer Internship,Penultimate,Software Developer,Closed,Melbourne,Summer,July,August,"Biotech, Defense, Technology",Australian Citizen,https://jobs.smartrecruiters.com/Leidos1/743999838036000-intern-software-developer-melbourne,,,"March 15, 2024 1:45 PM"
Leidos,Graduate Cyber Analyst,Grad Program,"Penultimate, Pre-Penultimate, Ultimate/Grad",Cyber Security,Closed,"Canberra, Melbourne",12 Months,March,April,Technology,Australian Citizen,https://prosple.com/graduate-employers/leidos/jobs-internships/graduate-cyber-analyst,,,"March 15, 2024 1:45 PM"
Leidos,Graduate Software Engineer,Grad Program,"Penultimate, Pre-Penultimate, Ultimate/Grad",Software Engineer,Closed,"Canberra, Melbourne",12 Months,March,April,Technology,Australian Citizen,https://prosple.com/graduate-employers/leidos/jobs-internships/graduate-software-engineer-2,,,"March 15, 2024 1:45 PM"
Level Crossing Removal Program,Level Crossing Removal Project Internship Program,6/12 Month Internship,"Penultimate, Pre-Penultimate, Ultimate/Grad","IT, Software Developer",Closed,Melbourne,6-12 months,August,September,"Government, Transportation",Full working rights,https://bigbuild.vic.gov.au/jobs/training-programs/level-crossing-removal-project-internship-program,,,"March 15, 2024 1:45 PM"
Lockheed Martin,Graduate Software Engineering Program,Grad Program,Ultimate/Grad,"Cyber Security, Data Scientist, Game Developer, IT, Network Engineer, Software Engineer, Systems Engineer, UX/UI Designer",Closed,,24 months,January,February,"Defense, Technology",Australian Citizen,https://www.lockheedmartin.com/en-au/careers/early-careers.html,,,"March 15, 2024 1:45 PM"
Lockheed Martin,Industry Based Learning Program,6/12 Month Internship,Penultimate,"Cyber Security, Hardware Engineer, Software Engineer",Closed,Adelaide,6-12 months,March,April,"Defense, Technology",Australian Citizen,https://www.lockheedmartin.com/en-au/careers/early-careers.html,,Separate to Monash’s IBL program,"March 15, 2024 1:45 PM"
Macquarie,Graduate Program,Grad Program,Ultimate/Grad,,Closed,Sydney,12-24 months,February,April,Banking,No information,https://www.macquarie.com/au/en/careers/graduates-and-interns/our-programs.html,,Commences Feb 2025,"March 15, 2024 1:45 PM"
Macquarie,Summer Internship Program,Summer Internship,Penultimate,,Closed,"Brisbane, Melbourne, Perth, Sydney","10-12 weeks, Summer",May,July,Banking,No information,,,,"March 15, 2024 1:45 PM"
Macquarie,Winter Development Program,Program,"Penultimate, Pre-Penultimate, Ultimate/Grad",,Closed,,Winter,January,March,Technology,No information,https://www.macquarie.com/au/en/careers/graduates-and-interns/our-programs.html,,"criteria : Science, technology, engineering and maths students or women from any discipline in their penultimate year of study","March 15, 2024 1:45 PM"
Macquarie Group,,Summer Internship,"Penultimate, Pre-Penultimate","Business Analyst, Mobile App Developer, Project Manager, Software Developer",Closed,"Brisbane, Melbourne, Sydney","10-12 weeks, Summer, Winter",May,July,"Banking, Finance","Australian Citizen, Australian Permanent Resident, New Zealand Citizen",https://www.macquarie.com/au/en/careers/graduates-and-interns/programs-and-business-groups.html,,"Melbourne stream closes earlier, compared to the Sydney stream.","March 15, 2024 1:45 PM"
Microsoft,,Summer Internship,Penultimate,"Data Scientist, Hardware Engineer, IT, Product Manager, Sales, Software Engineer, UX/UI Designer",Closed,"Melbourne, Sydney",Summer,,,Technology,"Australian Citizen, Australian Permanent Resident, International, New Zealand Citizen",https://careers.microsoft.com/students/us/en/aunzuniversityinternship,,,"March 15, 2024 1:45 PM"
MongoDB,,Summer Internship,Penultimate,"Product Designer, Software Engineer",Closed,Sydney,Summer,July,August,Technology,No information,https://gradaustralia.com.au/graduate-employers/mongodb/jobs-internships/20222023-software-engineering-internship-summer,,,"March 15, 2024 1:45 PM"
NAB,,6/12 Month Internship,"Penultimate, Ultimate/Grad","Business Analyst, Cloud Engineer, Data Analyst, Data Engineer, DevOps Engineer, Financial Crimes Analyst, Project Analyst, Software Engineer",Closed,"Melbourne, Sydney","6-12 months, Semester 1, Semester 2",July,August,"Banking, Finance","Australian Citizen, Australian Permanent Resident, New Zealand Citizen",https://www.nab.com.au/about-us/careers/early-careers/information-technology-internship,,"The technology program can be done by pre-penultimate students. ","March 15, 2024 1:45 PM"
NAB,NAB Technology Intern Program,6/12 Month Internship,"Penultimate, Pre-Penultimate, Ultimate/Grad","Business Analyst, Cloud Engineer, Data Engineer, Project Analyst, Software Engineer",Closed,"Brisbane, Melbourne, Sydney",6-12 months,March,,Banking,"Australian Citizen, Australian Permanent Resident, New Zealand Citizen",https://www.nab.com.au/about-us/careers/early-careers/information-technology-internship,,,"March 15, 2024 1:45 PM"
NAB,NAB Graduate Program,Grad Program,Ultimate/Grad,,Closed,Melbourne,,February,April,Banking,"Australian Citizen, Australian Permanent Resident, New Zealand Citizen",https://www.nab.com.au/about-us/careers/early-careers/graduate-careers,,,"March 15, 2024 1:45 PM"
NAB,NAB Summer Intern Program,Summer Internship,Penultimate,,Closed,"Brisbane, Melbourne, Perth, Sydney",Summer,July,August,Banking,"Australian Citizen, Australian Permanent Resident, New Zealand Citizen",https://www.nab.com.au/about-us/careers/early-careers/summer-intern-program,,You’ll need to be due to complete your degree by December 2025,"March 15, 2024 1:45 PM"
Optiver,Future Focus,Program,Pre-Penultimate,"Hardware Engineer, Quantitative Researcher, Software Developer, Trader",Closed,Sydney,2-3 Days,February,May,Trading,"Australian Citizen, Australian Permanent Resident, New Zealand Citizen",https://www.optiver.com/working-at-optiver/career-opportunities/?filter-level=internship&filter-office=sydney,,,"March 15, 2024 1:45 PM"
Optiver,Future Focus,Program,Pre-Penultimate,"Software Engineer, Trader",Closed,Sydney,2-3 Days,,,Trading,,,,,"March 15, 2024 1:45 PM"
Origin Energy,,Grad Program,Ultimate/Grad,"Business Analyst, Cloud Engineer, Data Analyst, Data Engineer, Machine Learning Engineer, Software Engineer",Closed,"Melbourne, Sydney",,,,Energy,,https://www.originenergy.com.au/about/careers/graduate-program/,,"Offers IBL placement through Monash. ","March 15, 2024 1:45 PM"
Palantir,Forward Deployed Software Engineer Graduate,Grad Program,Ultimate/Grad,Software Engineer,Closed,Sydney,,May,June,"Big Data and Analytics, Defense, Government, Intelligence",Australian Temporary Work Visa,https://www.palantir.com/careers/students-and-early-talent/#new-grads-early-talent,,,"March 15, 2024 1:45 PM"
Planet Innovation,,Summer Internship,Penultimate,"Product Designer, Product Manager, Software Engineer",Closed,Melbourne,Summer,,November,Healthtech,,https://jobs.lever.co/planetinnovation,,,"March 15, 2024 1:45 PM"
PwC,Trainee Program,1 Year+ Internship,Pre-Penultimate,"Data Analyst, Data Scientist",Closed,"Brisbane, Canberra, Melbourne, Sydney",24 months,,,Consulting,"Australian Citizen, Australian Permanent Resident",https://jobs-au.pwc.com/au/en/trainee-program-2023,,,"March 15, 2024 1:45 PM"
PwC,Graduate Program,Grad Program,Ultimate/Grad,"Cyber Security, Digital Strategist, Project Manager, Software Engineer",Closed,"Brisbane, Canberra, Melbourne, Sydney",,February,,Consulting,"Australian Citizen, Australian Permanent Resident",https://jobs-au.pwc.com/au/en/graduate-program,,,"March 15, 2024 1:45 PM"
Quantium,,Summer Internship,Penultimate,"Data Analyst, Software Engineer",Closed,"Brisbane, Canberra, Melbourne, Sydney",Summer,March,July,"Artificial Intelligence, Big Data and Analytics, Consulting, Data Science","Australian Citizen, Australian Permanent Resident",https://au.gradconnection.com/employers/quantium/#our-internship-academy,,,"March 15, 2024 1:45 PM"
RACV,Technology Graduate,Grad Program,Ultimate/Grad,,Closed,Melbourne,12 Months,May,June,Retail and Sales,"Australian Citizen, Australian Permanent Resident, Australian Temporary Work Visa",https://au.prosple.com/graduate-employers/racv/jobs-internships/technology-graduate-pre-register,,,"March 15, 2024 1:45 PM"
RACV,"Growth, Strategy & Analytics Graduate",Grad Program,Ultimate/Grad,"Business Analyst, Data Engineer, Data Scientist",Closed,Melbourne,12 Months,May,June,Retail and Sales,"Australian Citizen, Australian Permanent Resident, Australian Temporary Work Visa",https://au.prosple.com/graduate-employers/racv/jobs-internships/growth-strategy-analytics-graduate-pre-register,,,"March 15, 2024 1:45 PM"
Reserve Bank of Australia,Reserve Bank Graduate Program,Grad Program,Ultimate/Grad,"Data Scientist, IT, Software Engineer",Closed,"Brisbane, Canberra, Melbourne, Perth, Sydney",24 months,February,April,"Finance, Government","Australian Citizen, Australian Permanent Resident, New Zealand Citizen",https://www.rba.gov.au/careers/careers-at-the-rba/students-and-graduates/information-technology.html,,"• Applications open: February
• Applications close: April
• Assessment and face to face interviews: May
• Offers made: May
• Program commences: February of the following year","March 15, 2024 1:45 PM"
SAP,,6/12 Month Internship,Ultimate/Grad,"Customer Experience, Sales",Closed,"Melbourne, Sydney",6-12 months,July,September,Technology,No information,https://www.sap.com/australia/about/careers/students-graduates/vocational-training/australia-and-new-zealand.html,,,"March 15, 2024 1:45 PM"
SAS,,Summer Internship,Penultimate,"Business Analyst, Tech Consultant",Closed,"Brisbane, Canberra, Melbourne, Perth, Sydney",Summer,December,January,"Big Data and Analytics, Consulting, Finance","Australian Citizen, Australian Permanent Resident, Full working rights",https://gradaustralia.com.au/graduate-employers/sas/jobs-internships/the-workforce-connection-program,,"Internship,Clerkship and placement","March 15, 2024 1:45 PM"
Schneider Electric,Technical Internship,6/12 Month Internship,Penultimate,"IT, Software Engineer",Closed,"Adelaide, Brisbane, Ingleburn, Melbourne, Perth, Sydney","6-12 months, Summer",,August,"Energy, Manufacturing","Australian Citizen, Australian Permanent Resident, New Zealand Citizen",https://www.se.com/au/en/about-us/careers/students-young-professionals.jsp,,"• Full time basis over Uni Summer break, and then continue on a part time basis (minimum 15 hours per week) for fifteen (15) weeks","March 15, 2024 1:45 PM"
Schneider Electric,Graduate Program,Grad Program,Ultimate/Grad,"IT, Software Engineer",Closed,"Adelaide, Brisbane, Ingleburn, Melbourne, Perth, Sydney",24 months,July,August,"Energy, Manufacturing","Australian Citizen, Australian Permanent Resident, New Zealand Citizen",https://www.se.com/au/en/about-us/careers/students-young-professionals.jsp,,,"March 15, 2024 1:45 PM"
Snap Inc.,,Summer Internship,Penultimate,Software Engineer,Closed,Sydney,Summer,February,,Technology,No information,https://wd1.myworkdaysite.com/recruiting/snapchat/snap/job/Sydney-Australia/Software-Engineer-Intern--Sydney_R0023106-1,,,"March 15, 2024 1:45 PM"
Startmate,Student Fellowship Winter,Program,"Penultimate, Pre-Penultimate, Ultimate/Grad",Software Engineer,Closed,"Adelaide, Melbourne, Perth, Remote, Sydney","2 weeks, Winter",April,May,Startups,,,"Program to inform students about the Australian Startup ecosystem. Students can potentially partake in speed interviews and mentorship which can lead to employment ",,"March 15, 2024 1:45 PM"
Startmate,Student Fellowship Summer,Program,"Penultimate, Pre-Penultimate, Ultimate/Grad",Software Engineer,Closed,"Adelaide, Melbourne, Perth, Remote, Sydney","2 weeks, Summer",September,November,Startups,,,"Program to inform students about the Australian Startup ecosystem. Students can potentially partake in speed interviews and mentorship which can lead to employment ",,"March 15, 2024 1:45 PM"
Susquehanna International Group (SIG),Discovery Day,Program,Pre-Penultimate,"Software Engineer, Trader",Closed,Sydney,2-3 Days,,,Trading,,,,,"March 15, 2024 1:45 PM"
TasNetworks,,Summer Internship,Penultimate,,Closed,,Summer,August,,Energy,,https://www.tasnetworks.com.au/careers/summer-student-program,,,"March 15, 2024 1:45 PM"
Telstra,,Summer Internship,Penultimate,"Data Analyst, Network Engineer, Product Designer, Software Engineer, Tech Consultant",Closed,Flexible,Summer,July,August,Telecom,"Australian Citizen, Australian Permanent Resident, International, New Zealand Citizen",https://careers.telstra.com/fields-of-work/students/summer-vacation-program,,"Must be a penultimate year student. ","March 15, 2024 1:45 PM"
The Trade Desk,,Summer Internship,Penultimate,Software Engineer,Closed,Sydney,Summer,,,Marketing,,https://careers.thetradedesk.com/us/en/job/REQ-5550/2023-Summer-Internship-Software-Engineering-Sydney,,,"March 15, 2024 1:45 PM"
Toll Group,Technology Graduate Program,Grad Program,"Penultimate, Ultimate/Grad",,Closed,Melbourne,12-24 months,February,April,Retail and Sales,,https://au.prosple.com/graduate-employers/toll-group/jobs-internships/technology-graduate-program-pre-register,,,"March 15, 2024 1:45 PM"
Transurban,,Summer Internship,Penultimate,,Closed,,,,,Transportation,,https://careers.transurban.com/blog/summer-intern-program,,Also offers IBL placement through Monash.,"March 15, 2024 1:45 PM"
Tyro,,Summer Internship,Penultimate,Software Engineer,Closed,Melbourne,Summer,March,,Healthtech,"Australian Citizen, Australian Permanent Resident, New Zealand Citizen, Subclass 462",https://jobs.lever.co/tyro/d08d2852-97c0-4baf-9006-96ea6d059a6b,,,"March 15, 2024 1:45 PM"
Victoria’s Big Build,Graduate Programs,Grad Program,Ultimate/Grad,"Business Analyst, Data Manager, IT, Project Manager, Software Engineer",Closed,Melbourne,24 months,February,April,"Government, Transportation",Full working rights,https://bigbuild.vic.gov.au/jobs/training-programs/graduate-programs,,,"March 15, 2024 1:45 PM"
Westpac,2024 Summer Intern Program,Summer Internship,"Penultimate, Pre-Penultimate, Ultimate/Grad",,Closed,Sydney,10 weeks,July,August,Banking,"Australian Citizen, Australian Permanent Resident, New Zealand Citizen, New Zealand Permanent Resident",https://prosple.com/graduate-employers/westpac-group/jobs-internships/global-transaction-services-summer-intern-program,,,"March 15, 2024 1:45 PM"
Westpac,,Summer Internship,Penultimate,"AI & ML Engineer, Business Analyst, Cloud Engineer, Cyber Security, Data Analyst, Data Scientist, Network Engineer, Platforms Engineer, Software Engineer, UX/UI Designer",Closed,,Summer,July,August,"Banking, Finance","Australian Citizen, Australian Permanent Resident, New Zealand Citizen",https://www.westpac.com.au/about-westpac/careers/pathways/grad-program/,,,"March 15, 2024 1:45 PM"
Woodside,,Summer Internship,Penultimate,"Business Analyst, Cloud Engineer, Data Analyst, Security Engineer, Software Engineer",Closed,"Karratha, Perth",Summer,July,August,Energy,"Australian Citizen, Australian Permanent Resident, New Zealand Citizen",https://www.woodside.com.au/careers/graduates-and-students,,,"March 15, 2024 1:45 PM"
WooliesX,,Grad Program,Ultimate/Grad,"Business Engineer, IT",Closed,Sydney,24 months,January,February,"Finance, Technology","Australian Citizen, Australian Permanent Resident, New Zealand Citizen",http://grads.woolworths.com.au/,,,"March 15, 2024 1:45 PM"
Xero,Intern Engineer,Summer Internship,Penultimate,,Closed,Canberra,Summer,June,July,Technology,"Australian Citizen, Australian Permanent Resident, Subclass 462",https://prosple.com/graduate-employers/xero/jobs-internships/xero-2020-grad-and-intern-programs,,,"March 15, 2024 1:45 PM"
Xero,,Summer Internship,Penultimate,Software Engineer,Closed,"Canberra, Melbourne",Summer,March,May,Technology,International,https://www.xero.com/au/about/graduate/internships/,,,"March 15, 2024 1:45 PM"
Zendesk,,Summer Internship,Penultimate,"Product Manager, Software Engineer",Closed,Melbourne,,,May,Technology,,https://jobs.zendesk.com/us/en/internships,,,"March 15, 2024 1:45 PM"
Snap Inc.,,6/12 Month Internship,Penultimate,Software Engineer,,Sydney,6-12 months,February,April,Technology,,https://wd1.myworkdaysite.com/recruiting/snapchat/snap/job/Sydney-Australia/Software-Engineering-Intern--Summer-2024--Sydney_R0033677-1,,,"March 15, 2024 1:45 PM"
,,,,,,,,,,,,,,,"March 15, 2024 1:45 PM"
,,,,,,,,,,,,,,,"March 15, 2024 1:45 PM"
,,,,,,,,,,,,,,,"March 15, 2024 1:45 PM"
,,,,,,,,,,,,,,,"March 15, 2024 1:45 PM"
,,,,,,,,,,,,,,,"March 15, 2024 1:45 PM"