Company,Name of program/role,Type,Course Progression,Roles,Status,Location,Duration,Open,Close,Industry,Work rights required,URL,Description,Notes,Last updated
Amazon/AWS,"2024 Software Dev Engineer Intern SYD, AWS",Summer Internship,Penultimate,Software Engineer,Open,Sydney,Summer,March,May,"Retail and Sales, Technology","Australian Citizen, Australian Permanent Resident, New Zealand Citizen",https://www.amazon.jobs/en/jobs/2580965/2024-software-dev-engineer-intern-syd-aws,,"Various non-tech roles also offered, see: https://www.amazon.jobs/en/teams/internships-for-students","March 15, 2024 1:45 PM"
Atlassian,Summer 2024/2025,Summer Internship,Penultimate,"Customer Experience, Data Analyst, Data Scientist, IT, Machine Learning Engineer, Product Designer, Product Manager, Sales, Security, Site Reliability Engineer, Software Engineer",Open,"Melbourne, Sydney",Summer,January,,Technology,"Australian Citizen, Australian Permanent Resident, New Zealand Citizen",https://www.atlassian.com/company/careers/all-jobs?team=&location=Australia&search=2024/2025,,,"March 15, 2024 1:45 PM"
Australian Defence Force,Graduate Entry,Grad Program,Ultimate/Grad,"Cyber Security, Data Scientist, IT, Software Engineer",Open,Australia Wide,12-36 Months,,,Defense,Australian Citizen,https://www.adfcareers.gov.au/jobs,,- Many IT/Engineering roles available for FIT degrees,"March 15, 2024 1:45 PM"
Australian Defence Force,Undergraduate Program,1 Year+ Internship,"Penultimate, Pre-Penultimate","Cyber Security, Data Scientist, IT, Software Engineer",Open,Australia Wide,12-36 Months,,,Defense,Australian Citizen,https://www.adfcareers.gov.au/jobs,,- Many IT/Engineering roles available for FIT degrees,"March 15, 2024 1:45 PM"
Australian Secret Intelligence Service,ACTIVATE Graduate Program,Grad Program,Ultimate/Grad,"Cloud Engineer, Customer Engineer, Cyber Security, Data Analyst, Data Engineer, Data Manager, Data Scientist, Network Engineer, Software Engineer",Open,Canberra,,,February,Government,Australian Citizen,https://www.asis.gov.au/Careers/Current-Vacancies/Graduate-Program/,,,"March 15, 2024 1:45 PM"
Australian Taxation Office,ATO University Paid Internship Program (UPIP),1 Year+ Internship,"Penultimate, Pre-Penultimate","Data Analyst, IT, Project Manager, Software Engineer, UX/UI Designer",Open,"Adelaide, Brisbane, Canberra, Hobart, Melbourne, Perth, Sydney",6-24 Months,,,"Finance, Government",Australian Citizen,https://www.ato.gov.au/about-ato/careers/entry-level-programs/university-paid-internship-program,,"• Applications are open all year round
• Three intakes per year (February, July, November). First intake is July 2024.","March 15, 2024 1:45 PM"
BCG,Graduate Program,Grad Program,Ultimate/Grad,,Open,"Canberra, Melbourne, Perth, Sydney",,January,March,Consulting,"Australian Citizen, Australian Permanent Resident, New Zealand Citizen",https://careers.bcg.com/australia-new-zealand-associate-recruitment,,,"March 15, 2024 1:45 PM"
BHP,,Summer Internship,Ultimate/Grad,"Cyber Security, Data Scientist, Software Engineer",Open,"Adelaide, Brisbane, Perth",10-12 weeks,March,April,Mining,Australian Citizen,https://careers.bhp.com/job/2024-Australian-Intern-Campaign/1138943300/,,,"March 15, 2024 1:45 PM"
Chevron,Information Technology,,"Penultimate, Ultimate/Grad",Information Technology,Open,Western Australia,,May,June,"Energy, Mining","Australian Citizen, Australian Permanent Resident",https://careers.chevron.com/job/perth/information-technology-chevron-intern-program/38138/61960686320,,,"March 15, 2024 1:45 PM"
Deloitte,Vacationer,Summer Internship,Penultimate,"Analytics and Cognitive, Business Engineer, Cloud Engineer, Data Analyst, Platforms Engineer, Software Engineer, Technology Audit",Open,"Canberra, Melbourne, Perth, Sydney","4-8 weeks, Summer","February, July","August, March",Consulting,"Australian Citizen, Australian Permanent Resident, International, New Zealand Citizen",https://www2.deloitte.com/au/en/pages/careers/articles/summer-vacation-program-careers.html,,Deloitte’s summer program has 2 intakes. The first one opens in February and the mid year one opens in July. Deloitte also offers an Insider program for pre-penultimate students.,"March 15, 2024 1:45 PM"
Dolby,,Summer Internship,Penultimate,Software Engineer,Open,Sydney,10-12 weeks,February,April,Technology,"Australian Citizen, Australian Permanent Resident, Australian Student Visa",,Intern Software Engineer (multiple roles),,"March 15, 2024 1:45 PM"
eclipse,,Summer Internship,Penultimate,Trader,Open,Hong Kong,,,,,,https://www.eclipsetrading.com/all-jobs/,,,"March 15, 2024 1:45 PM"
eclipse,,Grad Program,Ultimate/Grad,Trader,Open,Hong Kong,,,,,,https://www.eclipsetrading.com/all-jobs/,,,"March 15, 2024 1:45 PM"
FDM Group,2024 Graduate Program,Grad Program,Ultimate/Grad,,Open,"Brisbane, Canberra, Melbourne, Perth, Sydney",24 months,September,June,Technology,"Australian Citizen, Australian Permanent Resident, New Zealand Citizen",https://careers.fdmgroup.com/vacancies/96/australia--2023-graduate-technical-consultant.html?utm_source=gradaustralia&utm_medium=jobad&utm_campaign=grad_tc_&utm_content=aus_,,2.5-year graduate program,"March 15, 2024 1:45 PM"
FDM Group,Project Grace: Technical Graduate Program,Grad Program,Ultimate/Grad,"Cloud Engineer, Data Analyst, Software Engineer, Technical Analyst",Open,"Brisbane, Canberra, Melbourne, Sydney",24 months,September,July,Technology,"Australian Citizen, Australian Permanent Resident, New Zealand Citizen",https://careers.fdmgroup.com/vacancies/405/project-grace-technical-graduate-program.html?utm_source=gradaustralia&utm_medium=jobad&utm_campaign=grad_projectgrace_tgp&utm_content=aus_,,2.5-year graduate program,"March 15, 2024 1:45 PM"
FDM Group,Technical Analysis Graduate Program,Grad Program,Ultimate/Grad,,Open,"Brisbane, Canberra, Melbourne, Sydney",12-24 months,September,May,Technology,"Australian Citizen, Australian Permanent Resident, New Zealand Citizen, Subclass 462",https://careers.fdmgroup.com/vacancies/244/australia--technical-analyst-consultant.html?utm_source=gradaustralia&utm_medium=jobad&utm_campaign=grad_ta_&utm_content=aus_,,2.5-year graduate program,"March 15, 2024 1:45 PM"
FDM Group,Software Development Graduate Program,Grad Program,Ultimate/Grad,,Open,"Brisbane, Canberra, Melbourne, Sydney",24 months,September,March,Technology,"Australian Citizen, Australian Permanent Resident, New Zealand Citizen",https://careers.fdmgroup.com/vacancies/217/australia--software-development-consultant.html?utm_source=gradaustralia&utm_medium=jobad&utm_campaign=grad_dev_&utm_content=aus_,,2.5-year graduate program,"March 15, 2024 1:45 PM"
IMC,Internship,Summer Internship,Penultimate,"Hardware Engineer, Software Engineer, Trader",Open,Sydney,10 weeks,January,August,"Technology, Trading","Australian Citizen, Australian Permanent Resident, New Zealand Citizen",,,,"March 15, 2024 1:45 PM"
Jane Street,,Summer Internship,Penultimate,"AI & ML EngineerBusiness AnalystCloud EngineerCyber SecurityData AnalystData EngineerData ScientistNetwork EngineerPenetration TesterSecuritySecurity EngineerSoftware Engineer, Linux Engineer, Product Engineer, Quantitative Researcher, Software Engineer, Trader",Open,Hong Kong,Summer,June,July,"Finance, Technology, Trading",,https://www.janestreet.com/join-jane-street/open-roles/?type=students-and-new-grads&location=hong-kong,,,"March 15, 2024 1:45 PM"
KPMG,Vacationer,Summer Internship,Penultimate,"Cyber Security, Data Analyst, Technology Advisory, Technology Risk",Open,"Adelaide, Canberra, Hobart, Melbourne, Sydney","4-8 weeks, Summer",February,April,Consulting,"Australian Permanent Resident, Full working rights, International",https://home.kpmg/au/en/home/careers/graduates/vacation-program.html,,,"March 15, 2024 1:45 PM"
McKinsey & Company,Women’s Internship & Scholarship,Summer Internship,"Penultimate, Pre-Penultimate","Business Analyst, Tech Consultant",Open,"Brisbane, Canberra, Melbourne, Perth, Sydney",Summer,,June,Consulting,"Australian Citizen, Australian Permanent Resident, New Zealand Citizen",https://www.mckinsey.com/au/careers/upcoming-opportunities/womens-internship-and-scholarship,,"$20,000 Scholarship","March 15, 2024 1:45 PM"
Optiver,,Summer Internship,Penultimate,"Hardware Engineer, Quantitative Researcher, Software Developer, Trader",Open,Sydney,Summer,February,May,Trading,"Australian Citizen, Australian Permanent Resident, New Zealand Citizen",https://www.optiver.com/working-at-optiver/career-opportunities/?filter-level=internship&filter-office=sydney,,,"March 15, 2024 1:45 PM"
PwC,Vacation Program,Summer Internship,Penultimate,"Cyber Security, Data Analyst, Digital Strategist, Project Manager, Software Engineer, Tech Consultant",Open,"Brisbane, Canberra, Melbourne, Sydney",Summer,"March, September","March, September","Consulting, Finance",Full working rights,https://www.pwc.com.au/careers/students/vacation-program.html,,PwC has two intakes. The first one opens in March and the second one in September.,"March 15, 2024 1:45 PM"
Rio Tinto,2024 Intern Program,Summer Internship,"Penultimate, Ultimate/Grad","Data Scientist, IT, Security Engineer, Software Engineer",Open,Perth,10-12 weeks,February,March,Mining,Australian Citizen,,,,"March 15, 2024 1:45 PM"
Susquehanna International Group (SIG),,Grad Program,Ultimate/Grad,"Equity Analyst, Trader",Open,Sydney,,January,,"Technology, Trading","Australian Citizen, Australian Permanent Resident, New Zealand Citizen",https://careers.sig.com,,,"March 15, 2024 1:45 PM"
Susquehanna International Group (SIG),,Summer Internship,Penultimate,"Equity Analyst, Quantitative Researcher, Software Developer, Software Engineer, Trader",Open,Sydney,Summer,January,May,"Technology, Trading","Australian Citizen, Australian Permanent Resident, Full working rights",https://careers.sig.com/sydney-campus,,,"March 15, 2024 1:45 PM"
Tibra Capital,Accelerator Program,Program,"Penultimate, Pre-Penultimate",Trader,Open,Sydney,,January,,,,https://apply.workable.com/tibra-capital-1/j/0E09BEE49D/apply/,,,"March 15, 2024 1:45 PM"
TikTok,Intern (TikTok Engineering) - 2024 start,6/12 Month Internship,"Penultimate, Pre-Penultimate, Ultimate/Grad","Back-end Engineer, Front-end Engineer, Mobile App Developer, Software Engineer",Open,Sydney,6-12 months,November,January,Technology,"Australian Citizen, Australian Permanent Resident, International",https://careers.tiktok.com/position?keywords=&category=&location=CT_244&project=&type=3&job_hot_flag=&current=1&limit=10&functionCategory=&tag=,,,"March 15, 2024 1:45 PM"
Accenture,Tech Bootcamp,Program,Penultimate,"Cloud Engineer, Mobile App Developer, Software Developer, Software Engineer",Closed,"Canberra, Melbourne, Sydney",2-3 Days,November,January,Consulting,"Australian Citizen, Australian Permanent Resident, New Zealand Citizen",https://www.accenture.com/au-en/careers/local/internships,,,"March 15, 2024 1:45 PM"
Accenture,Internship,Summer Internship,Penultimate,Tech Consultant,Closed,Melbourne,Summer,June,July,Consulting,"Australian Citizen, Australian Permanent Resident, New Zealand Citizen",https://www.accenture.com/au-en/careers/local/internships,,,"March 15, 2024 1:45 PM"
Additive Assurance,,Summer Internship,Penultimate,"Machine Learning Engineer, Software Engineer",Closed,Melbourne,Summer,August,November,"Manufacturing, Technology","Australian Citizen, Australian Permanent Resident, New Zealand Citizen",https://mailto:careers@additiveassurance.com,,Click on page to find out all the details,"March 15, 2024 1:45 PM"
Adobe,,Summer Internship,Penultimate,"Digital Strategist, Sales, Software Engineer, Solutions Consultant",Closed,Sydney,Summer,,December,Technology,"Australian Citizen, Australian Permanent Resident, New Zealand Citizen",https://www.adobe.com/careers.html,,,"March 15, 2024 1:45 PM"
Airwallex,,Summer Internship,Penultimate,Software Engineer,Closed,Melbourne,Summer,March,,,International,https://jobs.lever.co/airwallex/98f20acd-3ca7-451a-a065-365f087a57ed,,,"March 15, 2024 1:45 PM"
Akuna Capital,,Summer Internship,Penultimate,"Quantitative Developer, Quantitative Researcher, Software Developer, Trader",Closed,Sydney,Summer,July,August,Trading,"Australian Citizen, Australian Permanent Resident, New Zealand Citizen",https://akunacapital.com/careers?&experience=intern&location=sydney&search_term=#careers,,"Note that the winter internship is offered to pre-penultimate students, and the summer internship is for penultimate students.","March 15, 2024 1:45 PM"
Amazon,Machine Learning Summer School 2024,Program,"Penultimate, Pre-Penultimate, Ultimate/Grad",Machine Learning Engineer,Closed,Remote,4-8 weeks,December,January,"Artificial Intelligence, Big Data and Analytics",,https://amazonmlsummerschoolaustralia.splashthat.com/?fbclid=PAAaad72dMSxMiicXSldrTZ4C7vnItTalnPHqiWCql-rtWbOnoXN2UwRgLk30_aem_AUbfAwXWoX3SDxHR-dWL2XYX01AVWu0xW1WCmgArLzYSXqaxpjvXV6O6GShUk_zgrSc1bDqJ_YgSj5hyx9k1mNuy,,ML virtual summer school for APAC students,"March 15, 2024 1:45 PM"
AMP,Technology Graduate Program,Grad Program,Ultimate/Grad,,Closed,Sydney,12-24 months,July,August,Retail and Sales,"Australian Citizen, Australian Permanent Resident, New Zealand Citizen",https://au.prosple.com/graduate-employers/amp/jobs-internships/technology-graduate-program-pre-register,,,"March 15, 2024 1:45 PM"
ANZ,,Summer Internship,Penultimate,"Business Analyst, Data Analyst, Security Engineer, Software Engineer",Closed,"Melbourne, Sydney",Summer,July,August,Banking,"Australian Citizen, Australian Permanent Resident, New Zealand Citizen",https://www.anz.com.au/careers/programs/summer-intern/,,,"March 15, 2024 1:45 PM"
ANZ,Graduate Program,Grad Program,Ultimate/Grad,,Closed,Australia Wide,6-24 Months,August,September,Banking,"Australian Citizen, Australian Permanent Resident, New Zealand Citizen",https://www.anz.com.au/careers/programs/graduates/,,"Other allowed Visas:
• Subclass 485 Temporary Graduate;
• Subclass 461 New Zealand Citizen Family Relationship;
• Subclass 801/802 Partner; or
• Subclass 155 Resident Return.","March 15, 2024 1:45 PM"
Apple,,Summer Internship,Penultimate,"Data Science Engineer, Data Visualisation Engineer, Mobile App Developer, Software Engineer",Closed,Sydney,,,November,Technology,Full working rights,https://jobs.apple.com/en-au/search?location=australia-AUSC&team=Internships-STDNT-INTRN,,,"March 15, 2024 1:45 PM"
Arcitecta,,Summer Internship,Penultimate,Software Engineer,Closed,Melbourne,Summer,,,,,https://www.arcitecta.com/internships/,,,"March 15, 2024 1:45 PM"
Arup,,Summer Internship,Penultimate,"Data Engineer, Security Engineer, Software Engineer",Closed,"Melbourne, Sydney",,,,Construction,,https://www.arup.com/careers/early-careers/internships/australasia-internships/internship-roles-with-arup-australasia,,,"March 15, 2024 1:45 PM"
Aurecon,Graduate Programme,Grad Program,Ultimate/Grad,"Software Engineer, Tech Consultant",Closed,,,February,April,"Construction, Consulting, Energy, Technology, Transportation","Australian Citizen, Full working rights, New Zealand Citizen",https://www.aurecongroup.com/careers/early-careers/graduate-programme,,- Must be studying Engineering,"March 15, 2024 1:45 PM"
Aurecon,Intern Programme,Summer Internship,Penultimate,"Software Engineer, Tech Consultant",Closed,,12 weeks,July,August,"Construction, Consulting, Energy, Technology, Transportation","Australian Citizen, Full working rights, New Zealand Citizen",https://www.aurecongroup.com/careers/early-careers/intern-programme#criteria,,- Must be studying Engineering,"March 15, 2024 1:45 PM"
Australia Post,2025 Graduate Program,Grad Program,Ultimate/Grad,,Closed,Melbourne,24 months,June,July,Retail and Sales,"Australian Citizen, Australian Permanent Resident, New Zealand Citizen",https://au.prosple.com/graduate-employers/australia-post/jobs-internships/2025-graduate-program-pre-register,,,"March 15, 2024 1:45 PM"
Australian Bureau of Statistics,ABS ICT Graduate Recruitment Program,Grad Program,Ultimate/Grad,"Cyber Security, Network Engineer, Software Engineer",Closed,"Adelaide, Brisbane, Canberra, Hobart, Melbourne, Perth, Sydney",12 Months,March,April,"Government, Technology",Australian Citizen,https://www.abs.gov.au/about/abs-careers/start-your-career-abs-graduate/information-and-communication-technology-graduates,,,"March 15, 2024 1:45 PM"
Australian Bureau Statistics,ABS Data Graduate Recruitment Program,Grad Program,Ultimate/Grad,Data Scientist,Closed,"Adelaide, Brisbane, Canberra, Hobart, Melbourne, Perth, Sydney",6-12 months,March,April,"Big Data and Analytics, Data Science, Government, Technology",Australian Citizen,https://www.abs.gov.au/about/abs-careers/start-your-career-abs-graduate/data-graduates,,,"March 15, 2024 1:45 PM"
Australian Federal Police,Graduate Program,Grad Program,Ultimate/Grad,"Cyber Security, Data Scientist, Forensics Technology, Network Engineer, Software Engineer, Systems Engineer",Closed,Canberra,12 Months,,,Government,Australian Citizen,https://www.afp.gov.au/jobs/pathway/university-graduate-program,,"- Majority of roles are in Canberra
- Program runs Feb to Feb each year","March 15, 2024 1:45 PM"
Australian Security Intelligence Organisation,Technologist Graduate Program,Grad Program,Ultimate/Grad,"AI & ML Engineer, Business Analyst, Cloud Engineer, Cyber Security, Data Analyst, Data Engineer, Data Scientist, Forensics Technology, IT, Network Engineer, Project Manager, Software Engineer",Closed,Canberra,12 Months,,,"Government, Intelligence",Australian Citizen,https://www.asio.gov.au/careers/graduates,,,"March 15, 2024 1:45 PM"
Australian Signals Directorate,Graduate Program,Grad Program,Ultimate/Grad,"AI & ML Engineer, Business Analyst, Cloud Engineer, Cyber Security, Data Analyst, Data Engineer, Data Scientist, Network Engineer, Penetration Tester, Security, Security Engineer, Software Engineer",Closed,"Brisbane, Canberra, Melbourne, Perth",,March,,"Government, Intelligence, Technology",Australian Citizen,https://www.asd.gov.au/careers/im-starting-my-career,,Vast majority of positions are based in Canberra.,"March 15, 2024 1:45 PM"
Australian Signals Directorate,Internship Program,Summer Internship,Penultimate,"AI & ML Engineer, Business Analyst, Cyber Security, Data Analyst, Data Scientist, IT, Information Technology, Software Engineer",Closed,"Brisbane, Canberra, Melbourne, Perth",12 weeks,March,,"Government, Intelligence, Technology",Australian Citizen,https://www.asd.gov.au/careers/im-starting-my-career,,Vast majority of positions are based in Canberra.,"March 15, 2024 1:45 PM"
Australian Signals Directorate,Cadetship Program,1 Year+ Internship,Pre-Penultimate,"AI & ML Engineer, Business Analyst, Cloud Engineer, Cyber Security, Data Analyst, Data Engineer, Data Scientist, Network Engineer, Penetration Tester, Security, Security Engineer, Software Engineer",Closed,"Brisbane, Canberra, Melbourne, Perth",12-36 Months,March,,"Government, Intelligence, Technology",Australian Citizen,https://www.asd.gov.au/careers/im-starting-my-career,,Vast majority of positions are based in Canberra.,"March 15, 2024 1:45 PM"
Australian Tax Office,ATO Graduate Program,Grad Program,Ultimate/Grad,"AI & ML Engineer, Business Analyst, Cloud Engineer, Cyber Security, Data Analyst, Data Scientist, IT, Software Engineer, UX/UI Designer",Closed,"Adelaide, Brisbane, Canberra, Hobart, Melbourne, Perth, Sydney",,March,April,"Finance, Government",Australian Citizen,https://www.ato.gov.au/about-ato/careers/entry-level-programs/the-ato-graduate-program/apply-for-the-graduate-program,,,"March 15, 2024 1:45 PM"
BAE Systems,Summer Internship,Summer Internship,Penultimate,IT,Closed,,12 weeks,August,,"Defense, Technology",Australian Citizen,https://www.baesystems.com/en-aus/careers/graduate-and-early-careers#1573679801007,,,"March 15, 2024 1:45 PM"
BAE Systems,Graduate Program,Grad Program,Ultimate/Grad,IT,Closed,,36 Months,March,April,"Defense, Technology",Australian Citizen,https://www.baesystems.com/en-aus/careers/graduate-and-early-careers#1573679801007,,,"March 15, 2024 1:45 PM"
BDO,Undergraduate Program,1 Year+ Internship,"Penultimate, Pre-Penultimate","Cyber Security, Forensics Technology, Tech Consultant",Closed,Melbourne,12-36 Months,February,March,"Accounting, Consulting","Australian Citizen, Australian Permanent Resident",https://www.bdo.com.au/en-au/about/student-careers#programs,,,"March 15, 2024 1:45 PM"
BDO,Vacation Program,Summer Internship,Penultimate,"Cyber Security, Forensics Technology, Tech Consultant",Closed,Melbourne,Summer,February,March,"Accounting, Consulting","Australian Citizen, Australian Permanent Resident",https://gradaustralia.com.au/graduate-employers/bdo/jobs-internships,,"Three intakes per year: June, November, January","March 15, 2024 1:45 PM"
BDO,Graduate Program,Grad Program,Ultimate/Grad,"Cyber Security, Forensics Technology, Tech Consultant",Closed,Melbourne,,February,March,"Accounting, Consulting","Australian Citizen, Australian Permanent Resident",https://www.bdo.com.au/en-au/about/student-careers#programs,,Intakes in Jan and June,"March 15, 2024 1:45 PM"
BHP,,Grad Program,Ultimate/Grad,"Data Scientist, Software Engineer",Closed,Melbourne,10-12 weeks,March,April,Mining,,https://www.bhp.com/careers/graduate-student-programs/australia,,,"March 15, 2024 1:45 PM"
Bloomberg,,Summer Internship,Penultimate,"Data Analyst, Sales, Software Engineer",Closed,APAC,Summer,,,"Banking, Finance",No information,https://www.bloomberg.com/company/career/engineering-apac/,,,"March 15, 2024 1:45 PM"
Boeing,Graduate Program,Grad Program,Ultimate/Grad,"Data Analyst, Software Engineer, Systems Engineer",Closed,"Adelaide, Amberley, Brisbane, Melbourne, Nowra, Williamtown",24 months,May,,"Aerospace, Defense",Full working rights,https://www.boeing.com.au/careers/interns-and-graduates.page,,,"March 15, 2024 1:45 PM"
Boeing,,Summer Internship,"Penultimate, Pre-Penultimate","Data Analyst, Software Engineer, Systems Engineer",Closed,"Adelaide, Amberley, Brisbane, Melbourne, Nowra, Williamtown",Summer,July,Mid-July,"Aerospace, Defense",Full working rights,https://www.boeing.com.au/careers/interns-and-graduates.page,,,"March 15, 2024 1:45 PM"
Canva,,Summer Internship,Penultimate,"AI & ML Engineer, Data Analyst, Infrastructure  Engineer, Product Designer, Product Engineer, Security Engineer, Software Engineer, UX/UI Designer",Closed,"Flexible, Melbourne, Sydney",Summer,March,June,Technology,"Full working rights, International",https://www.lifeatcanva.com/en/jobs/?search=&location=Sydney&type=Internship&pagesize=20#results,Canva Summer Tech Internships 23/24,"Engineering internships are posted first, followed by design/misc roles.","March 15, 2024 1:45 PM"
CISCO,,Summer Internship,Penultimate,"Automation Engineer, Network Engineer, Site Reliability Engineer, Systems Engineer, Technical Support",Closed,"Brisbane, Canberra, Melbourne, Perth, Sydney",6-12 months,,,Technology,"Australian Citizen, Australian Permanent Resident, New Zealand Citizen",https://jobs.cisco.com/jobs/SearchJobs/?21178=%5B214420%5D&21178_format=6020&21180=%5B165%5D&21180_format=6022&listFilterMode=1,,,"March 15, 2024 1:45 PM"
Citadel,Discovery Day,Program,Pre-Penultimate,"Software Engineer, Trader",Closed,Sydney,2-3 Days,,,Trading,,,,,"March 15, 2024 1:45 PM"
"Citadel Securities ",,Summer Internship,Penultimate,"Quantitative Researcher, Software Engineer, Trader",Closed,Sydney,Summer,February,October,"Banking, Finance",No information,https://www.citadelsecurities.com/careers/open-roles/roles-for-students/?keyword=Intern,,,"March 15, 2024 1:45 PM"
Coles,Technology & Digital Graduate Program,Grad Program,Ultimate/Grad,,Closed,Melbourne,,February,April,Retail and Sales,"Australian Citizen, Australian Permanent Resident, New Zealand Citizen, New Zealand Permanent Resident",https://prosple.com/graduate-employers/coles/jobs-internships/2024-technology-graduate-program-pre-register,,,"March 15, 2024 1:45 PM"
Coles,Engineering and Logistics Graduate Program,Grad Program,Ultimate/Grad,,Closed,NSW,,February,April,Retail and Sales,"Australian Citizen, Australian Permanent Resident, New Zealand Citizen, New Zealand Permanent Resident",https://prosple.com/graduate-employers/coles/jobs-internships/2024-engineering-and-logistics-graduate-program-pre-register,,*duration not specified,"March 15, 2024 1:45 PM"
Commonwealth Bank,Global Markets Summer Analyst Program,Summer Internship,"Penultimate, Pre-Penultimate, Ultimate/Grad",,Closed,Sydney,Summer,May,July,Banking,"Australian Citizen, Australian Permanent Resident",https://prosple.com/graduate-employers/commonwealth-bank/jobs-internships/202324-commbank-global-markets-summer-analyst-program,,,"March 15, 2024 1:45 PM"
Commonwealth Bank,Engineering Summer Intern Program,Summer Internship,"Penultimate, Pre-Penultimate, Ultimate/Grad",,Closed,"Melbourne, Perth, Sydney",Summer,July,August,Banking,"Australian Citizen, Australian Permanent Resident, New Zealand Citizen",https://prosple.com/graduate-employers/commonwealth-bank/jobs-internships/202324-engineering-summer-intern-program,,,"March 15, 2024 1:45 PM"
Commonwealth Bank,Data Science and Analytics Summer Intern Program,Summer Internship,Penultimate,"Data Analyst, Data Science Engineer",Closed,"Melbourne, Perth, Sydney",Summer,July,August,Banking,"Australian Citizen, Australian Permanent Resident, New Zealand Citizen",https://prosple.com/graduate-employers/commonwealth-bank/jobs-internships/202324-data-science-and-analytics-summer-intern-program,,*New Zealand citizen already residing in Australia,"March 15, 2024 1:45 PM"
Commonwealth Bank,Bankwest Technology Graduate Program,Grad Program,Ultimate/Grad,,Closed,"Perth, Western Australia",12-24 months,March,April,Banking,"Australian Citizen, Australian Permanent Resident, New Zealand Citizen",https://prosple.com/graduate-employers/commonwealth-bank/jobs-internships/2024-bankwest-technology-graduate-program,,,"March 15, 2024 1:45 PM"
